<?xml version="1.0" encoding="UTF-8"?>
<!DOCTYPE document SYSTEM "../../../units/schema/language.dtd">
<document>
	<language short="en">
		<constant name="menu_leads">Leads</constant>
		<constant name="menu_results">Show leads</constant>
		<constant name="menu_types">Manage types</constant>
		<constant name="menu_export">Export</constant>

		<constant name="title_results">Leads: Results</constant>
		<constant name="title_types">Leads: Types</constant>
		<constant name="title_types_new">Leads: New type</constant>
		<constant name="title_types_change">Leads: Change type</constant>
		<constant name="title_types_delete">Leads: Delete type</constant>

		<constant name="message_types_saved">Leads type was saved!</constant>
		<constant name="message_types_delete">You are about to remove the following type and all of it's entries. Are you sure?</constant>
		<constant name="message_types_deleted">Specified type and its entries were removed!</constant>

		<constant name="column_name">Name</constant>

		<constant name="label_name">Name:</constant>
		<constant name="label_fields">Fields:</constant>
		<constant name="label_unique_address">Allow only one entry per IP address</constant>
		<constant name="label_send_email">Send email to default recipient on submit</constant>
	</language>
	<language short="he">
		<constant name="menu_leads">Leads</constant>
		<constant name="menu_results">Show leads</constant>
		<constant name="menu_types">Manage types</constant>
		<constant name="menu_export">Export</constant>

		<constant name="title_results">Leads: Results</constant>
		<constant name="title_types">Leads: Types</constant>
		<constant name="title_types_new">Leads: New type</constant>
		<constant name="title_types_change">Leads: Change type</constant>
		<constant name="title_types_delete">Leads: Delete type</constant>

		<constant name="message_types_saved">Leads type was saved!</constant>
		<constant name="message_types_delete">You are about to remove the following type and all of it's entries. Are you sure?</constant>
		<constant name="message_types_deleted">Specified type and its entries were removed!</constant>

		<constant name="column_name">Name</constant>

		<constant name="label_name">Name:</constant>
		<constant name="label_fields">Fields:</constant>
		<constant name="label_unique_address">Allow only one entry per IP address</constant>
		<constant name="label_send_email">Send email to default recipient on submit</constant>
	</language>
</document>
