<?xml version="1.0" encoding="UTF-8"?>
<!DOCTYPE document SYSTEM "../../../units/schema/language.dtd">
<document>
	<language short="en" rtl="no">
		<constant name="country_field_name">Country list</constant>
		<constant name="state_field_name">State list</constant>
	</language>

	<language short="he" rtl="no">
		<constant name="country_field_name">Country list</constant>
		<constant name="state_field_name">State list</constant>
	</language>

	<language short="ar" rtl="no">
		<constant name="country_field_name">Country list</constant>
		<constant name="state_field_name">State list</constant>
	</language>

	<language short="sr" rtl="no">
		<constant name="country_field_name">Country list</constant>
		<constant name="state_field_name">State list</constant>
	</language>
</document>
