<?xml version="1.0" encoding="UTF-8"?>
<!DOCTYPE document SYSTEM "../../../units/schema/language.dtd">
<document>
	<language short="en">
		<constant name="menu_affiliates">Affiliates</constant>
		<constant name="menu_manage_affiliates">Manage affiliates</constant>
		<constant name="menu_referral_urls">Referral URLs</constant>
		<constant name="menu_information">Affiliate information</constant>

		<constant name="title_referrals">Affiliate Referrals</constant>
		<constant name="title_affiliates">Manage Affiliates</constant>
		<constant name="title_affiliates_add">Affiliates: Add new</constant>
		<constant name="title_affiliates_change">Affiliates: Change data</constant>
		<constant name="title_affiliates_delete">Affiliates: Delete affiliate</constant>
		<constant name="title_affiliate_information">Affiliate Information</constant>

		<constant name="message_affiliate_saved">Affiliate data was saved!</constant>
		<constant name="message_affiliate_not_unique">New affiliate was not saved because specified ID is not unique!</constant>
		<constant name="message_affiliate_delete">You are about to remove the following affiliate and accumulated data with it. Are you sure?</constant>
		<constant name="message_affiliate_deleted">Affiliate and its referrals were deleted.</constant>

		<constant name="new_affiliate">New affiliate</constant>
		<constant name="group_by">Group by:</constant>
		<constant name="affiliate">Affiliate:</constant>

		<constant name="column_name">Name</constant>
		<constant name="column_referrals">Referrals</constant>
		<constant name="column_clicks">Clicks</constant>
		<constant name="column_conversions">Conversions</constant>
		<constant name="column_rate">Rate</constant>
		<constant name="column_affiliate">Affiliate</constant>
		<constant name="column_url">Referral URL</constant>
		<constant name="column_landing">Landing page</constant>

		<constant name="label_name">Name:</constant>
		<constant name="label_uid">Unique ID:</constant>
		<constant name="label_user">System user:</constant>
		<constant name="label_active">Affiliate account is active</constant>
		<constant name="label_clicks">Clicks:</constant>
		<constant name="label_conversions">Conversions:</constant>
		<constant name="label_rate">Rate:</constant>
		<constant name="label_url">Page URL:</constant>
		<constant name="label_url_output">URL with affiliate ID:</constant>

		<constant name="tab_general">Information</constant>
		<constant name="tab_generate">Generate URL</constant>

		<constant name="option_url">Referral URL</constant>
		<constant name="option_landing">Landing page</constant>
	</language>
</document>
