<?xml version="1.0" encoding="UTF-8"?>
<!DOCTYPE document SYSTEM "../../../units/schema/language.dtd">
<document>
	<language short="en">
		<constant name="menu_tips">Tips</constant>
		<constant name="menu_tips_manage">Edit tips</constant>

		<constant name="title_tips_manage">Tips</constant>
		<constant name="title_tips_new">Tips: Create new</constant>
		<constant name="title_tips_change">Tips: Change tip data</constant>
		<constant name="title_tips_delete">Tips: Delete tip</constant>

		<constant name="message_tip_saved">Tip data was saved.</constant>
		<constant name="message_tip_delete">You are about to remove the following tip. Are you sure?</constant>
		<constant name="message_tip_deleted">Specified tip was removed from the system.</constant>

		<constant name="column_tip">Tip</constant>

		<constant name="label_content">Content:</constant>
		<constant name="label_visible">This tip is visible</constant>
	</language>
	<language short="he">
		<constant name="menu_tips">טיפים</constant>
		<constant name="menu_tips_manage">ערוך טיפים</constant>

		<constant name="title_tips_manage">טיפים</constant>
		<constant name="title_tips_new">טיפים : צור חדש</constant>
		<constant name="title_tips_change">טיפים : שנה תוכן הטיפ</constant>
		<constant name="title_tips_delete">טיפים : מחק טיפ</constant>

		<constant name="message_tip_saved">תוכן הטיפ נשמר</constant>
		<constant name="message_tip_delete">אתה עומד למחוק את הטיפ, אתה בטוח?</constant>
		<constant name="message_tip_deleted">הטיפ הוסר מהמערכת.</constant>

		<constant name="column_tip">טיפ</constant>

		<constant name="label_content">תוכן:</constant>
		<constant name="label_visible">הטיפ מוצג</constant>
	</language>
</document>
