<?xml version="1.0" encoding="UTF-8"?>
<!DOCTYPE document SYSTEM "../../../units/schema/language.dtd">
<document>
	<language short="en">
		<constant name="menu_faq">FAQ</constant>
		<constant name="menu_manage_questions">Manage questions</constant>

		<constant name="title_questions">FAQ</constant>
		<constant name="title_question_new">FAQ: New question</constant>
		<constant name="title_question_change">FAQ: Change question</constant>
		<constant name="title_question_delete">FAQ: Delete question</constant>

		<constant name="message_question_delete">You are about to remove the following question. Are you sure?</constant>
		<constant name="message_question_deleted">Question was deleted!</constant>
		<constant name="message_question_saved">Question data was saved!</constant>

		<constant name="new_question">New question</constant>

		<constant name="column_question">Question</constant>

		<constant name="label_question">Question:</constant>
		<constant name="label_answer">Answer:</constant>
		<constant name="label_visible">Question is visible</constant>
	</language>
</document>
