<?xml version="1.0" encoding="UTF-8"?>
<!DOCTYPE document SYSTEM "../units/schema/language.dtd">
<document>
	<language name="Srpski" short="sr">
		<constant name="backend_copyright"><![CDATA[Copyright &copy; by <a href="http://way2cu.com">Way2CU</a>. Icons by <a href="http://commons.wikimedia.org/wiki/User:Paintpot">Paintpot</a>. All rights reserved!]]></constant>

		<!-- Column Names -->
		<constant name="column_options">Opcije</constant>

		<!-- Buttons -->
		<constant name="add">Unos</constant>
		<constant name="new">Novo</constant>
		<constant name="change">Izmena</constant>
		<constant name="delete">Brisanje</constant>
		<constant name="save">Snimi</constant>
		<constant name="submit">Pošalji</constant>
		<constant name="send">Pošalji</constant>
		<constant name="upload">Pošalji</constant>
		<constant name="cancel">Otkaži</constant>
		<constant name="open">Otvori</constant>
		<constant name="close">Zatvori</constant>
		<constant name="reset">Resetuj</constant>
		<constant name="filter">Filtriraj</constant>
		<constant name="search">Pronađi</constant>
		<constant name="next">Dalje</constant>
		<constant name="back">Nazad</constant>
		<constant name="print">Štampa</constant>

		<!-- Messages -->
		<constant name="message_server_error">Server je naišao na sledeću grešku prilikom obrade podataka:</constant>
		<constant name="message_license_error">Nije Vam dozvoljena upotreba podataka sa ovog sajta!</constant>

		<!-- Page switch -->
		<constant name="page_first">Prva</constant>
		<constant name="page_previous">Prethodna</constant>
		<constant name="page_next">Sledeća</constant>
		<constant name="page_last">Poslednja</constant>

		<!-- Other language specific data formats -->
		<constant name="format_date">d.m.Y.</constant>
		<constant name="format_date_short">d.m.Y.</constant>
		<constant name="format_time">H:i:s</constant>
		<constant name="format_time_short">H:i:s</constant>
	</language>
	<language name="English" short="en" default="yes">
		<constant name="backend_copyright"><![CDATA[Copyright &copy; by <a href="http://way2cu.com">Way2CU</a>. Icons by <a href="http://commons.wikimedia.org/wiki/User:Paintpot">Paintpot</a>. All rights reserved!]]></constant>

		<!-- Column Names -->
		<constant name="column_options">Options</constant>

		<!-- Buttons -->
		<constant name="add">Add</constant>
		<constant name="new">New</constant>
		<constant name="change">Change</constant>
		<constant name="delete">Delete</constant>
		<constant name="save">Save</constant>
		<constant name="submit">Submit</constant>
		<constant name="send">Send</constant>
		<constant name="upload">Upload</constant>
		<constant name="cancel">Cancel</constant>
		<constant name="open">Open</constant>
		<constant name="close">Close</constant>
		<constant name="reset">Reset</constant>
		<constant name="filter">Filter</constant>
		<constant name="search">Search</constant>
		<constant name="next">Next</constant>
		<constant name="back">Back</constant>
		<constant name="print">Print</constant>

		<!-- Messages -->
		<constant name="message_server_error">Server experienced the following error:</constant>
		<constant name="message_license_error">You are not authorized to use services from this site!</constant>

		<!-- Page switch -->
		<constant name="page_first">First</constant>
		<constant name="page_previous">Previous</constant>
		<constant name="page_next">Next</constant>
		<constant name="page_last">Last</constant>

		<!-- Other language specific data formats -->
		<constant name="format_date">m/d/Y</constant>
		<constant name="format_date_short">m/d/Y</constant>
		<constant name="format_time">H:i:s</constant>
		<constant name="format_time_short">H:i:s</constant>
	</language>
	<language name="Español" short="es" >
		<constant name="backend_copyright"><![CDATA[Copyright &copy; by <a href="http://way2cu.com">Way2CU</a>. Icons by <a href="http://commons.wikimedia.org/wiki/User:Paintpot">Paintpot</a>. All rights reserved!]]></constant>

		<!-- Column Names -->
		<constant name="column_options">Options</constant>

		<!-- Buttons -->
		<constant name="add">Add</constant>
		<constant name="new">New</constant>
		<constant name="change">Change</constant>
		<constant name="delete">Delete</constant>
		<constant name="save">Save</constant>
		<constant name="submit">Submit</constant>
		<constant name="send">Enviar</constant>
		<constant name="upload">Upload</constant>
		<constant name="cancel">Cancel</constant>
		<constant name="open">Open</constant>
		<constant name="close">Close</constant>
		<constant name="reset">Borrar</constant>
		<constant name="filter">Filter</constant>

		<!-- Messages -->
		<constant name="message_server_error">Server experienced the following error:</constant>
		<constant name="message_license_error">You are not authorized to use services from this site!</constant>

		<!-- Page switch -->
		<constant name="page_first">First</constant>
		<constant name="page_previous">Previous</constant>
		<constant name="page_next">Next</constant>
		<constant name="page_last">Last</constant>

		<!-- Other language specific data formats -->
		<constant name="format_date">m/d/Y</constant>
		<constant name="format_date_short">m/d/Y</constant>
		<constant name="format_time">H:i:s</constant>
		<constant name="format_time_short">H:i:s</constant>
	</language>
	<language name="עברית" short="he" rtl="yes">
		<constant name="backend_copyright"><![CDATA[Copyright &copy; by <a href="http://way2cu.com">Way2CU</a>. Icons by <a href="http://commons.wikimedia.org/wiki/User:Paintpot">Paintpot</a>. All rights reserved!"]]></constant>

		<!-- Column Names -->
		<constant name="column_options">אפשרויות</constant>

		<!-- Buttons -->
		<constant name="add">הוסף</constant>
		<constant name="new">חדש</constant>
		<constant name="change">שנה</constant>
		<constant name="delete">מחק</constant>
		<constant name="save">שמור</constant>
		<constant name="submit">עדכן</constant>
		<constant name="send">שלח</constant>
		<constant name="upload">העלה</constant>
		<constant name="cancel">בטל</constant>
		<constant name="open">פתח</constant>
		<constant name="close">סגור</constant>
		<constant name="reset">אפס</constant>
		<constant name="filter">לסנן</constant>
		<constant name="search">לחפש</constant>
		<constant name="next">הבא</constant>
		<constant name="back">הקודם</constant>
		<constant name="print">Print</constant>

		<!-- Messages -->
		<constant name="message_server_error">השרת חווה את הבעיה הבאה:</constant>
		<constant name="message_license_error">אינך מורשה לקבל שירותים מאתר זה</constant>

		<!-- Page switch -->
		<constant name="page_first">ראשון</constant>
		<constant name="page_previous">הקודם</constant>
		<constant name="page_next">הבא</constant>
		<constant name="page_last">אחרון</constant>

		<!-- Other language specific data formats -->
		<constant name="format_date">d.m.Y.</constant>
		<constant name="format_date_short">d.m.Y.</constant>
		<constant name="format_time">H:i:s</constant>
		<constant name="format_time_short">H:i:s</constant>
	</language>
</document>
