<!DOCTYPE document SYSTEM "../../../units/schema/language.dtd">
<document>
	<language name="English" short="en">
		<constant name="menu_title" value="Kabalah"/>
		<constant name="menu_questions" value="Edit questions" />
		<constant name="menu_answers" value="Edit answers" />

		<constant name="title_questions" value="Kabalah: Questions" />
		<constant name="title_questions_new" value="Create question" />
		<constant name="title_questions_change" value="Change question" />
		<constant name="title_questions_delete" value="Delete question" />
		<constant name="title_fields" value="Kabalah Fields: " />
		<constant name="title_fields_new" value="Create field" />
		<constant name="title_fields_change" value="Change field" />
		<constant name="title_fields_delete" value="Delete field" />
		<constant name="title_answers" value="Kabalah: Answers" />
		<constant name="title_answers_new" value="Create answer" />
		<constant name="title_answers_change" value="Change answer" />
		<constant name="title_answers_delete" value="Delete answer" />

		<constant name="message_question_saved" value="Question data has been saved!"/>
		<constant name="message_question_delete" value="The following question will be removed from the system. Additionaly all answers and fields related to this question will be removed too! Are you sure?"/>
		<constant name="message_question_deleted" value="Question data has been deleted!"/>
		<constant name="message_field_saved" value="Field data has been saved!"/>
		<constant name="message_field_delete" value="The following field will be removed from the system. Are you sure?"/>
		<constant name="message_field_deleted" value="Field data has been deleted!"/>
		<constant name="message_answer_saved" value="Answer data has been saved!"/>
		<constant name="message_answer_delete" value="The following answer will be removed from the system. Are you sure?"/>
		<constant name="message_answer_deleted" value="Answer data has been deleted!"/>

		<constant name="new" value="Create new" />
		<constant name="change" value="Change" />
		<constant name="delete" value="Delete" />
		<constant name="fields" value="Fields" />
		<constant name="save" value="Save" />
		<constant name="reset" value="Reset" />
		<constant name="cancel" value="Cancel" />
		<constant name="close" value="Close" />

		<constant name="label_question_id" value="ID Number:"/>
		<constant name="label_question_title" value="Title:"/>
		<constant name="label_question_short_description" value="Short description:"/>
		<constant name="label_question_description" value="Description:"/>
		<constant name="label_question_formula" value="Formula &lt;small&gt;(eg.: sum($name) + $last_name[1] / 2)&lt;/small&gt;:"/>
		<constant name="label_field_question" value="Question:"/>
		<constant name="label_field_type" value="Type:"/>
		<constant name="label_field_name" value="Name:"/>
		<constant name="label_field_label" value="Label:"/>
		<constant name="label_field_default" value="Default value:"/>
		<constant name="label_field_order" value="Order:"/>
		<constant name="label_answer_number" value="Result number:"/>
		<constant name="label_answer_question" value="Question:"/>
		<constant name="label_answer_title" value="Title:"/>
		<constant name="label_answer_short_description" value="Short description:"/>
		<constant name="label_answer_description" value="Description:"/>

		<constant name="field_type_text" value="Text"/>
		<constant name="field_type_date" value="Date"/>
		<constant name="field_type_number" value="Number"/>

		<constant name="column_question_id" value="ID"/>
		<constant name="column_question_title" value="Title"/>
		<constant name="column_field_name" value="Name"/>
		<constant name="column_field_type" value="Type"/>
		<constant name="column_answer_number" value="Result"/>
		<constant name="column_answer_answer" value="Answer title"/>
		<constant name="column_answer_question" value="Question"/>
		<constant name="column_options" value="Options"/>
	</language>
	<language name="Hebrew" short="heb">
		<constant name="menu_title" value="קבלה" />
		<constant name="menu_questions" value="ערוך שאלות" />
		<constant name="menu_answers" value="ערוך תשובות לשאלה" />

		<constant name="title_questions" value="קבלה : שאלות" />
		<constant name="title_questions_new" value="צור שאלה" />
		<constant name="title_questions_change" value="ערוך שאלה" />
		<constant name="title_questions_delete" value="מחק שאלה" />
		<constant name="title_fields" value="קבלה : שדות" />
		<constant name="title_fields_new" value="Create field" />
		<constant name="title_fields_change" value="Change field" />
		<constant name="title_fields_delete" value="Delete field" />
		<constant name="title_answers" value="קבלה : תשובות" />
		<constant name="title_answers_new" value="צור תשובה" />
		<constant name="title_answers_change" value="ערוך תשובה" />
		<constant name="title_answers_delete" value="מחק תשובה" />

		<constant name="message_question_saved" value="תוכן השאלה נשמר!"/>
		<constant name="message_question_delete" value="The following question will be removed from the system. Additionaly all answers and fields related to this question will be removed too! Are you sure?"/>
		<constant name="message_question_deleted" value="תוכן השאלה הוסר!"/>
		<constant name="message_field_saved" value="Field data has been saved!"/>
		<constant name="message_field_delete" value="The following field will be removed from the system. Are you sure?"/>
		<constant name="message_field_deleted" value="Field data has been deleted!"/>
		<constant name="message_answer_saved" value="תוכן השאלה נשמר בהצלחה!"/>
		<constant name="message_answer_delete" value="השאלה תוסר מהמערכת, האם אתה בטוח?"/>
		<constant name="message_answer_deleted" value="תוכן התשובה נמחק!"/>

		<constant name="new" value="צור" />
		<constant name="change" value="ערוך" />
		<constant name="delete" value="מחק" />
		<constant name="fields" value="Fields" />
		<constant name="save" value="שמור" />
		<constant name="reset" value="אפס" />
		<constant name="cancel" value="בטל" />
		<constant name="close" value="סגור" />

		<constant name="label_question_id" value="מספר זיהוי"/>
		<constant name="label_question_title" value="כותרת:"/>
		<constant name="label_question_short_description" value="תאור קצר:"/>
		<constant name="label_question_description" value="תאור:"/>
		<constant name="label_question_formula" value="Formula &lt;small&gt;(eg.: sum($name) + $last_name[1] / 2)&lt;/small&gt;:"/>
		<constant name="label_field_question" value="Question:"/>
		<constant name="label_field_type" value="Type:"/>
		<constant name="label_field_name" value="Name:"/>
		<constant name="label_field_label" value="Label:"/>
		<constant name="label_field_default" value="Default value:"/>
		<constant name="label_answer_number" value="תוצאת החישוב:"/>
		<constant name="label_answer_question" value="שאלה:"/>
		<constant name="label_answer_title" value="כותרת:"/>
		<constant name="label_answer_short_description" value="תאור קצר:"/>
		<constant name="label_answer_description" value="תאור:"/>

		<constant name="field_type_text" value="Text"/>
		<constant name="field_type_date" value="Date"/>
		<constant name="field_type_number" value="Number"/>

		<constant name="column_question_id" value="מספר"/>
		<constant name="column_question_title" value="כותרת"/>
		<constant name="column_field_name" value="Name"/>
		<constant name="column_field_type" value="Type"/>
		<constant name="column_answer_number" value="תוצאה"/>
		<constant name="column_answer_answer" value="כותרת התשובה"/>
		<constant name="column_answer_question" value="שאלה"/>
		<constant name="column_options" value="אשפרויות"/>
	</language>
</document>
